[I 2024-10-24 13:24:50,437] Trial 0 finished with value: 8.737907409667969 and parameters: {'batch_size': 128, 'epochs': 153, 'optimizer': 'sgd', 'activation': 'tanh', 'dropout_rate': 0.46283407844445834}. Best is trial 0 with value: 8.737907409667969.
[I 2024-10-24 13:25:11,914] Trial 1 finished with value: 10.965017318725586 and parameters: {'batch_size': 128, 'epochs': 62, 'optimizer': 'adam', 'activation': 'relu', 'dropout_rate': 0.4029480555952918}. Best is trial 0 with value: 8.737907409667969.
[W 2024-10-24 13:25:52,941] Trial 2 failed with parameters: {'batch_size': 32, 'epochs': 109, 'optimizer': 'sgd', 'activation': 'relu', 'dropout_rate': 0.40336568910461956} because of the following error: The value nan is not acceptable.
[W 2024-10-24 13:25:52,941] Trial 2 failed with value nan.
[I 2024-10-24 13:27:31,047] Trial 3 finished with value: 8.510821342468262 and parameters: {'batch_size': 32, 'epochs': 159, 'optimizer': 'rmsprop', 'activation': 'tanh', 'dropout_rate': 0.3429040884522064}. Best is trial 3 with value: 8.510821342468262.
[I 2024-10-24 13:28:26,433] Trial 4 finished with value: 8.742900848388672 and parameters: {'batch_size': 32, 'epochs': 90, 'optimizer': 'rmsprop', 'activation': 'tanh', 'dropout_rate': 0.2431762603082255}. Best is trial 3 with value: 8.510821342468262.
[I 2024-10-24 13:29:05,701] Trial 5 finished with value: 9.989762306213379 and parameters: {'batch_size': 128, 'epochs': 115, 'optimizer': 'adam', 'activation': 'tanh', 'dropout_rate': 0.21197926710333254}. Best is trial 3 with value: 8.510821342468262.
[I 2024-10-24 13:30:09,196] Trial 6 finished with value: 9.786335945129395 and parameters: {'batch_size': 128, 'epochs': 188, 'optimizer': 'adam', 'activation': 'relu', 'dropout_rate': 0.2573247068429777}. Best is trial 3 with value: 8.510821342468262.
[I 2024-10-24 13:30:42,881] Trial 7 finished with value: 9.251405715942383 and parameters: {'batch_size': 64, 'epochs': 70, 'optimizer': 'adam', 'activation': 'relu', 'dropout_rate': 0.3711951192521967}. Best is trial 3 with value: 8.510821342468262.
[I 2024-10-24 13:31:49,388] Trial 8 finished with value: 9.124900817871094 and parameters: {'batch_size': 32, 'epochs': 88, 'optimizer': 'adam', 'activation': 'tanh', 'dropout_rate': 0.4192002137968802}. Best is trial 3 with value: 8.510821342468262.
[I 2024-10-24 13:33:16,701] Trial 9 finished with value: 8.71070384979248 and parameters: {'batch_size': 32, 'epochs': 143, 'optimizer': 'rmsprop', 'activation': 'tanh', 'dropout_rate': 0.4113832956923703}. Best is trial 3 with value: 8.510821342468262.
[I 2024-10-24 13:34:06,647] Trial 10 finished with value: 8.564417839050293 and parameters: {'batch_size': 32, 'epochs': 80, 'optimizer': 'rmsprop', 'activation': 'tanh', 'dropout_rate': 0.26161770468636514}. Best is trial 3 with value: 8.510821342468262.
[I 2024-10-24 13:35:03,060] Trial 11 finished with value: 8.016473770141602 and parameters: {'batch_size': 64, 'epochs': 200, 'optimizer': 'sgd', 'activation': 'sigmoid', 'dropout_rate': 0.31698003121795554}. Best is trial 11 with value: 8.016473770141602.
[I 2024-10-24 13:35:59,670] Trial 12 finished with value: 7.990545749664307 and parameters: {'batch_size': 64, 'epochs': 199, 'optimizer': 'sgd', 'activation': 'sigmoid', 'dropout_rate': 0.32636413624372956}. Best is trial 12 with value: 7.990545749664307.
[I 2024-10-24 13:36:56,439] Trial 13 finished with value: 7.935468673706055 and parameters: {'batch_size': 64, 'epochs': 199, 'optimizer': 'sgd', 'activation': 'sigmoid', 'dropout_rate': 0.3145172965972561}. Best is trial 13 with value: 7.935468673706055.
[I 2024-10-24 13:37:47,350] Trial 14 finished with value: 7.981540679931641 and parameters: {'batch_size': 64, 'epochs': 179, 'optimizer': 'sgd', 'activation': 'sigmoid', 'dropout_rate': 0.306715460900538}. Best is trial 13 with value: 7.935468673706055.
[I 2024-10-24 13:38:36,927] Trial 15 finished with value: 7.876826286315918 and parameters: {'batch_size': 64, 'epochs': 174, 'optimizer': 'sgd', 'activation': 'sigmoid', 'dropout_rate': 0.29349972002278535}. Best is trial 15 with value: 7.876826286315918.
[I 2024-10-24 13:39:24,481] Trial 16 finished with value: 7.91642951965332 and parameters: {'batch_size': 64, 'epochs': 167, 'optimizer': 'sgd', 'activation': 'sigmoid', 'dropout_rate': 0.28602365626098164}. Best is trial 15 with value: 7.876826286315918.
[I 2024-10-24 13:40:00,586] Trial 17 finished with value: 7.914346694946289 and parameters: {'batch_size': 64, 'epochs': 126, 'optimizer': 'sgd', 'activation': 'sigmoid', 'dropout_rate': 0.2788562150611049}. Best is trial 15 with value: 7.876826286315918.
[I 2024-10-24 13:40:36,453] Trial 18 finished with value: 8.092684745788574 and parameters: {'batch_size': 64, 'epochs': 125, 'optimizer': 'sgd', 'activation': 'sigmoid', 'dropout_rate': 0.20798026020192512}. Best is trial 15 with value: 7.876826286315918.
[I 2024-10-24 13:41:08,390] Trial 19 finished with value: 7.702158451080322 and parameters: {'batch_size': 64, 'epochs': 111, 'optimizer': 'sgd', 'activation': 'sigmoid', 'dropout_rate': 0.3675934443396222}. Best is trial 19 with value: 7.702158451080322.
[I 2024-10-24 13:41:40,135] Trial 20 finished with value: 8.041799545288086 and parameters: {'batch_size': 64, 'epochs': 109, 'optimizer': 'sgd', 'activation': 'sigmoid', 'dropout_rate': 0.3763861749788876}. Best is trial 19 with value: 7.702158451080322.
[I 2024-10-24 13:42:21,015] Trial 21 finished with value: 7.873703956604004 and parameters: {'batch_size': 64, 'epochs': 141, 'optimizer': 'sgd', 'activation': 'sigmoid', 'dropout_rate': 0.4966985162481221}. Best is trial 19 with value: 7.702158451080322.
[I 2024-10-24 13:43:01,088] Trial 22 finished with value: 7.775886058807373 and parameters: {'batch_size': 64, 'epochs': 139, 'optimizer': 'sgd', 'activation': 'sigmoid', 'dropout_rate': 0.49235770516928345}. Best is trial 19 with value: 7.702158451080322.
[I 2024-10-24 13:43:41,315] Trial 23 finished with value: 8.125697135925293 and parameters: {'batch_size': 64, 'epochs': 140, 'optimizer': 'sgd', 'activation': 'sigmoid', 'dropout_rate': 0.4987306216188228}. Best is trial 19 with value: 7.702158451080322.
[I 2024-10-24 13:44:12,047] Trial 24 finished with value: 7.992498397827148 and parameters: {'batch_size': 64, 'epochs': 107, 'optimizer': 'sgd', 'activation': 'sigmoid', 'dropout_rate': 0.49838373607206427}. Best is trial 19 with value: 7.702158451080322.
[I 2024-10-24 13:44:51,783] Trial 25 finished with value: 8.195887565612793 and parameters: {'batch_size': 64, 'epochs': 137, 'optimizer': 'sgd', 'activation': 'sigmoid', 'dropout_rate': 0.45756323038957514}. Best is trial 19 with value: 7.702158451080322.
[I 2024-10-24 13:45:20,496] Trial 26 finished with value: 7.875045299530029 and parameters: {'batch_size': 64, 'epochs': 99, 'optimizer': 'sgd', 'activation': 'sigmoid', 'dropout_rate': 0.45260253988264093}. Best is trial 19 with value: 7.702158451080322.
[W 2024-10-24 13:45:35,100] Trial 27 failed with parameters: {'batch_size': 64, 'epochs': 50, 'optimizer': 'sgd', 'activation': 'relu', 'dropout_rate': 0.4731266913222862} because of the following error: The value nan is not acceptable.
[W 2024-10-24 13:45:35,100] Trial 27 failed with value nan.
[W 2024-10-24 13:46:12,401] Trial 28 failed with parameters: {'batch_size': 64, 'epochs': 131, 'optimizer': 'sgd', 'activation': 'relu', 'dropout_rate': 0.4744366755652636} because of the following error: The value nan is not acceptable.
[W 2024-10-24 13:46:12,402] Trial 28 failed with value nan.
[W 2024-10-24 13:46:55,327] Trial 29 failed with parameters: {'batch_size': 64, 'epochs': 151, 'optimizer': 'sgd', 'activation': 'relu', 'dropout_rate': 0.4392539022757537} because of the following error: The value nan is not acceptable.
[W 2024-10-24 13:46:55,328] Trial 29 failed with value nan.
[W 2024-10-24 13:47:32,393] Trial 30 failed with parameters: {'batch_size': 64, 'epochs': 130, 'optimizer': 'sgd', 'activation': 'relu', 'dropout_rate': 0.48054843065964836} because of the following error: The value nan is not acceptable.
[W 2024-10-24 13:47:32,393] Trial 30 failed with value nan.
[W 2024-10-24 13:48:09,411] Trial 31 failed with parameters: {'batch_size': 64, 'epochs': 130, 'optimizer': 'sgd', 'activation': 'relu', 'dropout_rate': 0.4817773821495204} because of the following error: The value nan is not acceptable.
[W 2024-10-24 13:48:09,411] Trial 31 failed with value nan.
[W 2024-10-24 13:48:52,049] Trial 32 failed with parameters: {'batch_size': 64, 'epochs': 149, 'optimizer': 'sgd', 'activation': 'relu', 'dropout_rate': 0.4379775354531413} because of the following error: The value nan is not acceptable.
[W 2024-10-24 13:48:52,050] Trial 32 failed with value nan.
[W 2024-10-24 13:49:29,395] Trial 33 failed with parameters: {'batch_size': 64, 'epochs': 131, 'optimizer': 'sgd', 'activation': 'relu', 'dropout_rate': 0.4781053815890479} because of the following error: The value nan is not acceptable.
[W 2024-10-24 13:49:29,396] Trial 33 failed with value nan.
[W 2024-10-24 13:50:12,840] Trial 34 failed with parameters: {'batch_size': 64, 'epochs': 153, 'optimizer': 'sgd', 'activation': 'relu', 'dropout_rate': 0.47911511001318957} because of the following error: The value nan is not acceptable.
[W 2024-10-24 13:50:12,840] Trial 34 failed with value nan.
[W 2024-10-24 13:50:27,445] Trial 35 failed with parameters: {'batch_size': 64, 'epochs': 50, 'optimizer': 'sgd', 'activation': 'relu', 'dropout_rate': 0.47627759174017403} because of the following error: The value nan is not acceptable.
[W 2024-10-24 13:50:27,446] Trial 35 failed with value nan.
[W 2024-10-24 13:51:05,012] Trial 36 failed with parameters: {'batch_size': 64, 'epochs': 131, 'optimizer': 'sgd', 'activation': 'relu', 'dropout_rate': 0.47563876964234764} because of the following error: The value nan is not acceptable.
[W 2024-10-24 13:51:05,013] Trial 36 failed with value nan.
[W 2024-10-24 13:51:42,271] Trial 37 failed with parameters: {'batch_size': 64, 'epochs': 131, 'optimizer': 'sgd', 'activation': 'relu', 'dropout_rate': 0.481810327667863} because of the following error: The value nan is not acceptable.
[W 2024-10-24 13:51:42,272] Trial 37 failed with value nan.
[W 2024-10-24 13:51:56,859] Trial 38 failed with parameters: {'batch_size': 64, 'epochs': 50, 'optimizer': 'sgd', 'activation': 'relu', 'dropout_rate': 0.48047415437698093} because of the following error: The value nan is not acceptable.
[W 2024-10-24 13:51:56,859] Trial 38 failed with value nan.
[W 2024-10-24 13:52:39,759] Trial 39 failed with parameters: {'batch_size': 64, 'epochs': 150, 'optimizer': 'sgd', 'activation': 'relu', 'dropout_rate': 0.478673926826582} because of the following error: The value nan is not acceptable.
[W 2024-10-24 13:52:39,759] Trial 39 failed with value nan.
[W 2024-10-24 13:53:16,988] Trial 40 failed with parameters: {'batch_size': 64, 'epochs': 131, 'optimizer': 'sgd', 'activation': 'relu', 'dropout_rate': 0.47638715157004724} because of the following error: The value nan is not acceptable.
[W 2024-10-24 13:53:16,988] Trial 40 failed with value nan.
[W 2024-10-24 13:53:54,277] Trial 41 failed with parameters: {'batch_size': 64, 'epochs': 131, 'optimizer': 'sgd', 'activation': 'relu', 'dropout_rate': 0.47612985508459643} because of the following error: The value nan is not acceptable.
[W 2024-10-24 13:53:54,277] Trial 41 failed with value nan.
[W 2024-10-24 13:54:36,488] Trial 42 failed with parameters: {'batch_size': 64, 'epochs': 149, 'optimizer': 'sgd', 'activation': 'relu', 'dropout_rate': 0.4806961065412023} because of the following error: The value nan is not acceptable.
[W 2024-10-24 13:54:36,488] Trial 42 failed with value nan.
[W 2024-10-24 13:55:19,172] Trial 43 failed with parameters: {'batch_size': 64, 'epochs': 151, 'optimizer': 'sgd', 'activation': 'relu', 'dropout_rate': 0.478953890877988} because of the following error: The value nan is not acceptable.
[W 2024-10-24 13:55:19,172] Trial 43 failed with value nan.
[W 2024-10-24 13:56:01,792] Trial 44 failed with parameters: {'batch_size': 64, 'epochs': 151, 'optimizer': 'sgd', 'activation': 'relu', 'dropout_rate': 0.4733242831089291} because of the following error: The value nan is not acceptable.
[W 2024-10-24 13:56:01,793] Trial 44 failed with value nan.
[W 2024-10-24 13:56:44,587] Trial 45 failed with parameters: {'batch_size': 64, 'epochs': 150, 'optimizer': 'sgd', 'activation': 'relu', 'dropout_rate': 0.47218673698490504} because of the following error: The value nan is not acceptable.
[W 2024-10-24 13:56:44,587] Trial 45 failed with value nan.
[W 2024-10-24 13:57:22,487] Trial 46 failed with parameters: {'batch_size': 64, 'epochs': 132, 'optimizer': 'sgd', 'activation': 'relu', 'dropout_rate': 0.47820538581029587} because of the following error: The value nan is not acceptable.
[W 2024-10-24 13:57:22,488] Trial 46 failed with value nan.
[W 2024-10-24 13:58:05,544] Trial 47 failed with parameters: {'batch_size': 64, 'epochs': 149, 'optimizer': 'sgd', 'activation': 'relu', 'dropout_rate': 0.4375601813490644} because of the following error: The value nan is not acceptable.
[W 2024-10-24 13:58:05,544] Trial 47 failed with value nan.
[W 2024-10-24 13:58:49,302] Trial 48 failed with parameters: {'batch_size': 64, 'epochs': 151, 'optimizer': 'sgd', 'activation': 'relu', 'dropout_rate': 0.4737944917253532} because of the following error: The value nan is not acceptable.
[W 2024-10-24 13:58:49,303] Trial 48 failed with value nan.
[W 2024-10-24 13:59:32,618] Trial 49 failed with parameters: {'batch_size': 64, 'epochs': 150, 'optimizer': 'sgd', 'activation': 'relu', 'dropout_rate': 0.4761451262268752} because of the following error: The value nan is not acceptable.
[W 2024-10-24 13:59:32,618] Trial 49 failed with value nan.
1701
5623
Best MAE: 7.702158451080322
Best Hyperparameters: {'batch_size': 64, 'epochs': 111, 'optimizer': 'sgd', 'activation': 'sigmoid', 'dropout_rate': 0.3675934443396222}
